address,cover_alt,cover_src,description,latitude,link,longitude,price,price_currency,price_for,price_specification,recommended_unit,recommended_bed,score,score_aggregate,score_reviews,suburb,title
"265 Little Bourke Street, 3000 Melbourne, Australia",Pullman Melbourne City Centre,https://cf.bstatic.com/xdata/images/hotel/square600/560744765.webp?k=094de7a3929208b37e3739814b12805644fc8eb055552b9e643b4e268b7594fc&o=,"With prime CBD location, Pullman Melbourne City Centre is close to Bourke Street Mall, offering a variety of shops, restaurants and cafes.

Dine at Eva's Restaurant & Bar for breakfast, lunch and dinner. Enjoy woodfired pizzas and local beverages at Blossom Rooftop Bar, with breathtaking views across Melbourne city from an alfresco rooftop area.

Spacious and modern guest rooms feature 55-inch televisions, FOXTEL Business, Nespresso machine, GHD straightener and BOSE wireless sound.

Rod Laver Arena, Crown Casino and Melbourne Convention and Exhibition Centre are located an easy tram or vehicle ride away.",-37.81298211,https://www.booking.com/hotel/au/pullman-melbourne-city-centre.en-gb.html?label=gen173nr-1BCAEoggI46AdIM1gEaA-IAQGYAQm4AQfIAQzYAQHoAQGIAgGoAgO4Asyg6bgGwAIB0gIkNDUzODliM2ItZThjZS00MDU4LThmOTctMTZhMmVlODlhZjlj2AIF4AIB&sid=3b52787ec2db0a5e6311a947ae7d40c6&aid=304142&ucfs=1&arphpl=1&checkin=2025-01-13&checkout=2025-01-14&dest_id=1593&dest_type=district&group_adults=1&req_adults=1&no_rooms=1&group_children=0&req_children=0&hpos=24&hapos=24&sr_order=class&nflt=ht_id%3D204&srpvid=947b662f65cb0907&srepoch=1729780584&all_sr_blocks=3588630_95158124_2_34_0_397487&highlighted_blocks=3588630_95158124_2_34_0_397487&matching_block_id=3588630_95158124_2_34_0_397487&sr_pri_blocks=3588630_95158124_2_34_0_397487_38000&from_sustainable_property_sr=1&from=searchresults,144.96525139,380,AUD,"1 night, 1 adult",Includes taxes and charges,Superior King Room,1 extra-large double bed,8.2,Very,1152,"Melbourne CBD, Melbourne",Pullman Melbourne City Centre
"187 Flinders Lane, 3000 Melbourne, Australia",Adelphi Hotel,https://cf.bstatic.com/xdata/images/hotel/square600/33090394.webp?k=d0e5af70788a3ce14ff5fc6559a43b27e29452f9d0180c5ac84b3a69d498ae49&o=,"Situated in the heart of the vibrant Flinders Lane shopping and dining precinct, Adelphi Hotel boasts free WiFi, free local phone calls and free in-room snacks and refreshments.

Conveniently located in Melbourne CBD, Hotel Adelphi is within 5 minutes’ walk of Flinders Street Station and Federation Square. Melbourne Cricket Ground (MCG), and Etihad Stadium are both less than 10 minutes’ drive away.

Each air-conditioned room features an iPod dock and flat-screen TV. There is also a refrigerator, work desk and a Lavazza coffee machine. The en suite bathroom includes bathrobes and a hairdryer. A room service menu is available 24/7.",-37.81615526,https://www.booking.com/hotel/au/adelphi-melbourne1.en-gb.html?label=gen173nr-1BCAEoggI46AdIM1gEaA-IAQGYAQm4AQfIAQzYAQHoAQGIAgGoAgO4Asyg6bgGwAIB0gIkNDUzODliM2ItZThjZS00MDU4LThmOTctMTZhMmVlODlhZjlj2AIF4AIB&sid=3b52787ec2db0a5e6311a947ae7d40c6&aid=304142&ucfs=1&arphpl=1&checkin=2025-01-13&checkout=2025-01-14&dest_id=1593&dest_type=district&group_adults=1&req_adults=1&no_rooms=1&group_children=0&req_children=0&hpos=25&hapos=25&sr_order=class&nflt=ht_id%3D204&srpvid=947b662f65cb0907&srepoch=1729780584&all_sr_blocks=59041107_297722615_0_0_0_501150&highlighted_blocks=59041107_297722615_0_0_0_501150&matching_block_id=59041107_297722615_0_0_0_501150&sr_pri_blocks=59041107_297722615_0_0_0_501150_60000&from_sustainable_property_sr=1&from=searchresults,144.96834214,600,AUD,"1 night, 1 adult",Includes taxes and charges,King Room,1 extra-large double bed,8.4,Very,993,"Melbourne CBD, Melbourne",Adelphi Hotel
"308 - 320 City Road, Southbank, 3000 Melbourne, Australia",Shadow Play by Peppers,https://cf.bstatic.com/xdata/images/hotel/square600/401405680.webp?k=2cb7e30c57194211fe69f71b8496fa8941f3dbb70cf860a59fd09215fdef2b5e&o=,"Set in Melbourne, 500 metres from Crown Casino Melbourne, Shadow Play by Peppers offers accommodation with an outdoor swimming pool, private parking, a fitness centre and a garden. Among the facilities of this property are a restaurant, a shared lounge and room service, along with free WiFi throughout the property. The property is 1.3 km from the city centre and less than 1 km from Eureka Tower.

The units at the hotel come with air conditioning, a seating area, a flat-screen TV with satellite channels, a kitchen, a dining area, a safety deposit box and a private bathroom with a shower, free toiletries and a hairdryer. At Shadow Play by Peppers all rooms come with bed linen and towels.

Guests at the accommodation can enjoy a continental or a vegetarian breakfast.

Shadow Play by Peppers offers 5-star accommodation with a sauna and terrace.

The hotel can conveniently provide information at the reception to help guests to get around the area.

Popular points of interest near Shadow Play by Peppers include Southbank Promenade, National Gallery of Victoria and Southern Cross Station. Essendon Fields Airport is 14 km away.",-37.827094,https://www.booking.com/hotel/au/shadow-play-by-peppers.en-gb.html?label=gen173nr-1BCAEoggI46AdIM1gEaA-IAQGYAQm4AQfIAQzYAQHoAQGIAgGoAgO4Asyg6bgGwAIB0gIkNDUzODliM2ItZThjZS00MDU4LThmOTctMTZhMmVlODlhZjlj2AIF4AIB&sid=3b52787ec2db0a5e6311a947ae7d40c6&aid=304142&ucfs=1&arphpl=1&checkin=2025-01-13&checkout=2025-01-14&dest_id=1593&dest_type=district&group_adults=1&req_adults=1&no_rooms=1&group_children=0&req_children=0&hpos=1&hapos=26&sr_order=class&nflt=ht_id%3D204&srpvid=947b662f65cb0907&srepoch=1729780330&all_sr_blocks=421172301_127938727_2_2_0&highlighted_blocks=421172301_127938727_2_2_0&matching_block_id=421172301_127938727_2_2_0&sr_pri_blocks=421172301_127938727_2_2_0__38600&from_sustainable_property_sr=1&from=searchresults,144.958382,386,AUD,"1 night, 1 adult",Includes taxes and charges,One-Bedroom Apartment,Entire apartment•1 bedroom•1 living room•1 bathroom•1 kitchen•34m²,8.0,Very,868,"Southbank, Melbourne",Shadow Play by Peppers
"25 Downie Street, 3000 Melbourne, Australia",Hyatt Centric Melbourne,https://cf.bstatic.com/xdata/images/hotel/square600/439383895.webp?k=feb935218683ed5c8b12393fcca5ea829fa72f4c2b6e2626f8fb6ef86a89382c&o=,"Well located in the centre of Melbourne, Hyatt Centric Melbourne provides air-conditioned rooms, a fitness centre, free WiFi and a restaurant. This 5-star hotel offers room service and a 24-hour front desk. Private parking is available on site.

Guest rooms at the hotel are equipped with a seating area, a flat-screen TV with cable channels and a safety deposit box. The rooms will provide guests with a fridge.

A buffet breakfast is available daily at Hyatt Centric Melbourne.

At the accommodation guests are welcome to take advantage of an indoor swimming pool.

Popular points of interest near Hyatt Centric Melbourne include Crown Casino Melbourne, Southern Cross Station and Block Arcade Melbourne. Essendon Fields Airport is 12 km away.",-37.820232,https://www.booking.com/hotel/au/hyatt-centric-melbourne.en-gb.html?label=gen173nr-1BCAEoggI46AdIM1gEaA-IAQGYAQm4AQfIAQzYAQHoAQGIAgGoAgO4Asyg6bgGwAIB0gIkNDUzODliM2ItZThjZS00MDU4LThmOTctMTZhMmVlODlhZjlj2AIF4AIB&sid=3b52787ec2db0a5e6311a947ae7d40c6&aid=304142&ucfs=1&arphpl=1&checkin=2025-01-13&checkout=2025-01-14&dest_id=1593&dest_type=district&group_adults=1&req_adults=1&no_rooms=1&group_children=0&req_children=0&hpos=2&hapos=27&sr_order=class&nflt=ht_id%3D204&srpvid=947b662f65cb0907&srepoch=1729780330&all_sr_blocks=777104608_336021038_2_2_0&highlighted_blocks=777104608_336021038_2_2_0&matching_block_id=777104608_336021038_2_2_0&sr_pri_blocks=777104608_336021038_2_2_0__47300&from_sustainable_property_sr=1&from=searchresults,144.955572,473,AUD,"1 night, 1 adult",Includes taxes and charges,Twin Room,2 single beds,8.8,Fabulous,1673,"Melbourne CBD, Melbourne",Hyatt Centric Melbourne
"Southgate Avenue, Southbank, 3000 Melbourne, Australia",Quay West Suites Melbourne,https://cf.bstatic.com/xdata/images/hotel/square600/276607528.webp?k=8a1739abcaf099fced861ad68edeff196d395225a7b569f150c1540005e29dc9&o=,"Surrounded by shops and restaurants in Melbourne CBD, this 5-star hotel offers spacious suites with LCD TVs, balconies, and panoramic views over Yarra River. Melbourne’s Southbank Promenade and tram station are 200 metres away.

Quay West Suites Melbourne provides suites that include fully equipped kitchens or kitchenettes, dining areas, and a furnished balcony.

Guests can enjoy using the 15-metre indoor lap pool, spa, sauna, and fitness center.

Meals and drinks are served indoors or outdoors on a spacious terrace at the hotel’s Jarrah Restaurant & Bar. The menu features seasonal specialities such as fresh local seafood, light pasta, simple grills and steaks.

Quay West Suites is a short walk from the Melbourne Arts Precinct, Eureka Skydeck, Melbourne Aquarium, Federation Square, and Victorian Arts Centre. Flinders Street Railway Station is a convenient 10-minute walk from the property.",-37.82047182,https://www.booking.com/hotel/au/quay-west-suites-melbourne.en-gb.html?label=gen173nr-1BCAEoggI46AdIM1gEaA-IAQGYAQm4AQfIAQzYAQHoAQGIAgGoAgO4Asyg6bgGwAIB0gIkNDUzODliM2ItZThjZS00MDU4LThmOTctMTZhMmVlODlhZjlj2AIF4AIB&sid=3b52787ec2db0a5e6311a947ae7d40c6&aid=304142&ucfs=1&arphpl=1&checkin=2025-01-13&checkout=2025-01-14&dest_id=1593&dest_type=district&group_adults=1&req_adults=1&no_rooms=1&group_children=0&req_children=0&hpos=3&hapos=28&sr_order=class&nflt=ht_id%3D204&srpvid=947b662f65cb0907&srepoch=1729780330&all_sr_blocks=4801115_94270287_1_1_0&highlighted_blocks=4801115_94270287_1_1_0&matching_block_id=4801115_94270287_1_1_0&sr_pri_blocks=4801115_94270287_1_1_0__53000&from_sustainable_property_sr=1&from=searchresults,144.96713698,530,AUD,"1 night, 1 adult",Includes taxes and charges,One-Bedroom Deluxe Suite with Balcony - Floors 10-15,Private suite,9.0,Superb,1732,"Southbank, Melbourne",Quay West Suites Melbourne
"1 Parliament Square, Off Parliament Place, East Melbourne, 3002 Melbourne, Australia",Park Hyatt Melbourne,https://cf.bstatic.com/xdata/images/hotel/square600/507219548.webp?k=49d768d131047509e571d129f93c3db7f6c51abb87a3c057b9d472d01576a147&o=,"This 5-star hotel offers an award-winning restaurant, luxurious accommodation and spa facilities, just 1.5 km from Melbourne’s city centre. It is a 4-minute walk from popular shopping precinct Collins Street, and a 5-minute walk from Princess Theatre.

Park Hyatt Melbourne provides a variety of rooms that feature city views, Art Deco and Ottoman décor, and spa-inspired Italian marble bathrooms. Free WiFi is included.

The Hotel’s restaurant is known for its creative contemporary cuisine as well as the Park Club Health & Day Spa.

Park Hyatt’s spa and wellness centre includes a fully equipped fitness centre, a 25-metre heated swimming pool, spa pool, sauna, steam room and outdoor sun terrace.

Nearby attractions include Melbourne Museum, Fitzroy Gardens, and Melbourne's theatre district and Chinatown. Queen Victoria Market is 3 km from the property.",-37.81141351,https://www.booking.com/hotel/au/park-hyatt-melbourne.en-gb.html?label=gen173nr-1BCAEoggI46AdIM1gEaA-IAQGYAQm4AQfIAQzYAQHoAQGIAgGoAgO4Asyg6bgGwAIB0gIkNDUzODliM2ItZThjZS00MDU4LThmOTctMTZhMmVlODlhZjlj2AIF4AIB&sid=3b52787ec2db0a5e6311a947ae7d40c6&aid=304142&ucfs=1&arphpl=1&checkin=2025-01-13&checkout=2025-01-14&dest_id=1593&dest_type=district&group_adults=1&req_adults=1&no_rooms=1&group_children=0&req_children=0&hpos=4&hapos=29&sr_order=class&nflt=ht_id%3D204&srpvid=947b662f65cb0907&srepoch=1729780330&all_sr_blocks=17810517_93712042_2_34_0&highlighted_blocks=17810517_93712042_2_34_0&matching_block_id=17810517_93712042_2_34_0&sr_pri_blocks=17810517_93712042_2_34_0__84700&from_sustainable_property_sr=1&from=searchresults,144.97620553,847,AUD,"1 night, 1 adult",Includes taxes and charges,King Room,1 extra-large double bed,9.1,Superb,1668,"East Melbourne, Melbourne",Park Hyatt Melbourne
"103 Little Collins Street, 3000 Melbourne, Australia","Next Hotel Melbourne, Curio Collection by Hilton",https://cf.bstatic.com/xdata/images/hotel/square600/513742616.webp?k=4e77492c28ba5ce1da28a5ab45f8c67d5f0ce1a178fc29a1c7bd28cc48898c5a&o=,"Well set in Melbourne, Next Hotel Melbourne, Curio Collection by Hilton provides air-conditioned rooms, a fitness centre, free WiFi and a restaurant. This 5-star hotel offers room service and a 24-hour front desk. Guests can have a drink at the bar.

At the hotel, each room includes a desk. Every room is equipped with a safety deposit box and selected rooms include city views. All units in Next Hotel Melbourne, Curio Collection by Hilton are equipped with a TV and free toiletries.

Breakfast is available daily, and includes à la carte, continental and American options.

Popular points of interest near the accommodation include Federation Square, St Paul's Cathedral and Block Arcade Melbourne. Essendon Fields Airport is 12 km away.",-37.81363706,https://www.booking.com/hotel/au/next-hotel-melbourne-curio-collection-by-hilton.en-gb.html?label=gen173nr-1BCAEoggI46AdIM1gEaA-IAQGYAQm4AQfIAQzYAQHoAQGIAgGoAgO4Asyg6bgGwAIB0gIkNDUzODliM2ItZThjZS00MDU4LThmOTctMTZhMmVlODlhZjlj2AIF4AIB&sid=3b52787ec2db0a5e6311a947ae7d40c6&aid=304142&ucfs=1&arphpl=1&checkin=2025-01-13&checkout=2025-01-14&dest_id=1593&dest_type=district&group_adults=1&req_adults=1&no_rooms=1&group_children=0&req_children=0&hpos=5&hapos=30&sr_order=class&nflt=ht_id%3D204&srpvid=947b662f65cb0907&srepoch=1729780330&all_sr_blocks=667523515_273262189_2_2_0&highlighted_blocks=667523515_273262189_2_2_0&matching_block_id=667523515_273262189_2_2_0&sr_pri_blocks=667523515_273262189_2_2_0__46800&from_sustainable_property_sr=1&from=searchresults,144.97023735,468,AUD,"1 night, 1 adult",Includes taxes and charges,Queen Room - Mobility Accessible,1 large double bed,8.8,Fabulous,2183,"Melbourne CBD, Melbourne","Next Hotel Melbourne, Curio Collection by Hilton"
"589-599 Little Collins Street, 3000 Melbourne, Australia","Holiday Inn Express Melbourne Little Collins, an IHG Hotel",https://cf.bstatic.com/xdata/images/hotel/square600/341680027.webp?k=221c59a5974ddd05033902edf333ba90766f6fd1c301f906d11088b6e976fec3&o=,"Boasting a fitness centre, a shared lounge as well as a bar, Holiday Inn Express Melbourne Little Collins, an IHG Hotel is situated in the centre of Melbourne, 500 metres from Southern Cross Station. This 4-star hotel offers a 24-hour front desk, a business centre and free WiFi. The property is non-smoking and is set less than 1 km from Crown Casino Melbourne.

The hotel will provide guests with air-conditioned rooms offering a desk, a kettle, a fridge, a safety deposit box, a TV and a private bathroom with a shower. At Holiday Inn Express Melbourne Little Collins, an IHG Hotel the rooms are fitted with bed linen and towels.

Guests at the accommodation can enjoy a buffet or a continental breakfast.

Popular points of interest near Holiday Inn Express Melbourne Little Collins, an IHG Hotel include Block Arcade Melbourne, Marvel Stadium and Melbourne Convention and Exhibition Centre. Essendon Fields Airport is 11 km from the property.",-37.81781160,https://www.booking.com/hotel/au/holiday-inn-express-melbourne-little-collins-an-ihg.en-gb.html?label=gen173nr-1BCAEoggI46AdIM1gEaA-IAQGYAQm4AQfIAQzYAQHoAQGIAgGoAgO4Asyg6bgGwAIB0gIkNDUzODliM2ItZThjZS00MDU4LThmOTctMTZhMmVlODlhZjlj2AIF4AIB&sid=3b52787ec2db0a5e6311a947ae7d40c6&aid=304142&ucfs=1&arphpl=1&checkin=2025-01-13&checkout=2025-01-14&dest_id=1593&dest_type=district&group_adults=1&req_adults=1&no_rooms=1&group_children=0&req_children=0&hpos=6&hapos=31&sr_order=class&nflt=ht_id%3D204&srpvid=947b662f65cb0907&srepoch=1729780330&all_sr_blocks=751949201_331779705_2_1_0_32433&highlighted_blocks=751949201_331779705_2_1_0_32433&matching_block_id=751949201_331779705_2_1_0_32433&sr_pri_blocks=751949201_331779705_2_1_0_32433_24900&from_sustainable_property_sr=1&from=searchresults,144.95524130,249,AUD,"1 night, 1 adult",Includes taxes and charges,Standard Queen Room,1 large double bed,8.5,Very,3793,"Melbourne CBD, Melbourne","Holiday Inn Express Melbourne Little Collins, an IHG Hotel"
"630 Little Collins Street, 3000 Melbourne, Australia",The Savoy Hotel on Little Collins Melbourne,https://cf.bstatic.com/xdata/images/hotel/square600/404852187.webp?k=6257d7ad3657a64e488150058c2bbac6520a1330ac856c35f7bac8157cbfd449&o=,"Conveniently located in Melbourne CBD, The Savoy Hotel is located within 5 minutes' walk of Collins Street and the Southern Cross Railway Station, which offers shops, cafes and restaurants. It features a fitness centre and a restaurant. Free WiFi is provided at the hotel.

Daily breakfast is served in the Curve Restaurant. Guests of the Savoy can also enjoy a drink at Alexander Bar and choose from an extensive wine list, where dinner is also served.

The Savoy Hotel Melbourne is situated 300 metres from the bank of the Yarra River. Tram connection is around the corner from the hotel and Marvel Stadium, Melbourne Aquarium and Melbourne Convention Centre are all within 1 km. Tullamarine Airport is less than 25 km away.

The newly refurbished spacious guest rooms feature stylish furnishings and include a work desk, a minibar, cable TV and in-house movies. Each air-conditioned room features a private bathroom with hairdryer.",-37.81774544,https://www.booking.com/hotel/au/vibe-savoy-melbourne.en-gb.html?label=gen173nr-1BCAEoggI46AdIM1gEaA-IAQGYAQm4AQfIAQzYAQHoAQGIAgGoAgO4Asyg6bgGwAIB0gIkNDUzODliM2ItZThjZS00MDU4LThmOTctMTZhMmVlODlhZjlj2AIF4AIB&sid=3b52787ec2db0a5e6311a947ae7d40c6&aid=304142&ucfs=1&arphpl=1&checkin=2025-01-13&checkout=2025-01-14&dest_id=1593&dest_type=district&group_adults=1&req_adults=1&no_rooms=1&group_children=0&req_children=0&hpos=7&hapos=32&sr_order=class&nflt=ht_id%3D204&srpvid=947b662f65cb0907&srepoch=1729780330&all_sr_blocks=3798422_244624358_1_41_0&highlighted_blocks=3798422_244624358_1_41_0&matching_block_id=3798422_244624358_1_41_0&sr_pri_blocks=3798422_244624358_1_41_0__31900&from_sustainable_property_sr=1&from=searchresults,144.95366558,319,AUD,"1 night, 1 adult",Includes taxes and charges,Savoy King Room,1 extra-large double bed,8.8,Fabulous,4830,"Melbourne CBD, Melbourne",The Savoy Hotel on Little Collins Melbourne
"8 Whiteman Street, Southbank, 3006 Melbourne, Australia",Crown Promenade Melbourne,https://cf.bstatic.com/xdata/images/hotel/square600/603945265.webp?k=6e673229c2a624a40ed38458ea21489aee99f48ceab7e1aa8edb6b32f0c11872&o=,"Located in the centre of Melbourne, Crown Promenade Melbourne offers an infinity pool, an outdoor terrace and a fully equipped fitness center. WiFi is available.

All rooms features city, bay or river views, an en-suite bathroom, a minibar and a flat screen TV with cable channels.

The property has a restaurant and a bar. The property also offers steam rooms, a heated spa and a masseuse.

Crown Promenade Melbourne is directly linked to the Crown Casino and Entertainment Complex.",-37.82375585,https://www.booking.com/hotel/au/crown-promenade.en-gb.html?label=gen173nr-1BCAEoggI46AdIM1gEaA-IAQGYAQm4AQfIAQzYAQHoAQGIAgGoAgO4Asyg6bgGwAIB0gIkNDUzODliM2ItZThjZS00MDU4LThmOTctMTZhMmVlODlhZjlj2AIF4AIB&sid=3b52787ec2db0a5e6311a947ae7d40c6&aid=304142&ucfs=1&arphpl=1&checkin=2025-01-13&checkout=2025-01-14&dest_id=1593&dest_type=district&group_adults=1&req_adults=1&no_rooms=1&group_children=0&req_children=0&hpos=8&hapos=33&sr_order=class&nflt=ht_id%3D204&srpvid=947b662f65cb0907&srepoch=1729780330&all_sr_blocks=3786101_131970484_0_2_0&highlighted_blocks=3786101_131970484_0_2_0&matching_block_id=3786101_131970484_0_2_0&sr_pri_blocks=3786101_131970484_0_2_0__37900&from_sustainable_property_sr=1&from=searchresults,144.95986283,379,AUD,"1 night, 1 adult",Includes taxes and charges,Standard King Room,1 extra-large double bed,8.5,Very,9441,"Southbank, Melbourne",Crown Promenade Melbourne
"443 Docklands Drive , Docklands, 3008 Melbourne, Australia",Vibe Hotel Melbourne Docklands,https://cf.bstatic.com/xdata/images/hotel/square600/583717840.webp?k=be7d59181e140ccf916154b82400fda3b1d30bbadf2d503c30abb85feefefcb9&o=,"Offering an outdoor pool, Vibe Melbourne Docklands is located in the heart of the popular Docklands area with countless restaurants and shops nearby. It is just 1 km from the Marvel Stadium and 2 km from Melbourne Convention and Exhibition Centre. Free Wi-Fi is offered.

All 273 guestrooms and studios at Vibe Melbourne Docklands boast city and water views, and a 42 inch flat-screen TV. Some rooms feature a bath.

The all-day dining restaurant at the property offers guests a healthy breakfast, tasty snacks and an a la carte dinner menu. Leisure facilities include a hot tub, steam room and an outdoor heated pool.

As a state-of-the-art conference hotel in Melbourne, a range of meeting rooms are available for guests events, for up to 200 people. All the meeting rooms offer free Wi-Fi and flexible set-ups.

Melbourne Airport is a 30-minute drive from Vibe Melbourne Docklands.",-37.81544600,https://www.booking.com/hotel/au/vibe-melbourne-docklands.en-gb.html?label=gen173nr-1BCAEoggI46AdIM1gEaA-IAQGYAQm4AQfIAQzYAQHoAQGIAgGoAgO4Asyg6bgGwAIB0gIkNDUzODliM2ItZThjZS00MDU4LThmOTctMTZhMmVlODlhZjlj2AIF4AIB&sid=3b52787ec2db0a5e6311a947ae7d40c6&aid=304142&ucfs=1&arphpl=1&checkin=2025-01-13&checkout=2025-01-14&dest_id=1593&dest_type=district&group_adults=1&req_adults=1&no_rooms=1&group_children=0&req_children=0&hpos=9&hapos=34&sr_order=class&nflt=ht_id%3D204&srpvid=947b662f65cb0907&srepoch=1729780330&all_sr_blocks=216276118_391312052_2_2_0&highlighted_blocks=216276118_391312052_2_2_0&matching_block_id=216276118_391312052_2_2_0&sr_pri_blocks=216276118_391312052_2_2_0__23120&from_sustainable_property_sr=1&from=searchresults,144.93820900,231,AUD,"1 night, 1 adult",Includes taxes and charges,Guest Room King,Multiple bed types,8.5,Very,3507,"Docklands, Melbourne",Vibe Hotel Melbourne Docklands
"50 Batman Street, West Melbourne, 3003 Melbourne, Australia",Courtyard by Marriott Melbourne Flagstaff Gardens,https://cf.bstatic.com/xdata/images/hotel/square600/437374224.webp?k=a9e36c656303ab723277d161188bc0c0b85b4ed8661c9a25cb01b2d578dcb8aa&o=,"Situated conveniently in the centre of Melbourne, Courtyard by Marriott Melbourne Flagstaff Gardens offers air-conditioned rooms, a fitness centre, free WiFi and a terrace. The property is close to several well-known attractions, 1.6 km from Melbourne City Conference Centre, 1.7 km from State Library of Victoria and 1.9 km from Block Arcade Melbourne. Guests can enjoy Australian and international dishes at the restaurant or have a cocktail at the bar.

The units at the hotel come with a seating area, a flat-screen TV and a safety deposit box. Featuring a private bathroom with a shower and free toiletries, certain units at Courtyard by Marriott Melbourne Flagstaff Gardens also have a city view. At the accommodation all rooms are equipped with bed linen and towels.

Guests at Courtyard by Marriott Melbourne Flagstaff Gardens can enjoy a buffet breakfast.

Staff at the hotel are available to provide information at the 24-hour front desk.

Popular points of interest near Courtyard by Marriott Melbourne Flagstaff Gardens include Southern Cross Station, Marvel Stadium and Crown Casino Melbourne. Essendon Fields Airport is 10 km away.",-37.81040898,https://www.booking.com/hotel/au/courtyard-by-marriott-melbourne-flagstaff-gardens.en-gb.html?label=gen173nr-1BCAEoggI46AdIM1gEaA-IAQGYAQm4AQfIAQzYAQHoAQGIAgGoAgO4Asyg6bgGwAIB0gIkNDUzODliM2ItZThjZS00MDU4LThmOTctMTZhMmVlODlhZjlj2AIF4AIB&sid=3b52787ec2db0a5e6311a947ae7d40c6&aid=304142&ucfs=1&arphpl=1&checkin=2025-01-13&checkout=2025-01-14&dest_id=1593&dest_type=district&group_adults=1&req_adults=1&no_rooms=1&group_children=0&req_children=0&hpos=10&hapos=35&sr_order=class&nflt=ht_id%3D204&srpvid=947b662f65cb0907&srepoch=1729780330&all_sr_blocks=800641805_341270408_0_2_0&highlighted_blocks=800641805_341270408_0_2_0&matching_block_id=800641805_341270408_0_2_0&sr_pri_blocks=800641805_341270408_0_2_0__28900&from_sustainable_property_sr=1&from=searchresults,144.95126050,289,AUD,"1 night, 1 adult",Includes taxes and charges,Deluxe King Room,1 extra-large double bed,8.9,Fabulous,855,"West Melbourne, Melbourne",Courtyard by Marriott Melbourne Flagstaff Gardens
