address,cover_alt,cover_src,description,latitude,link,longitude,price,price_currency,price_for,price_specification,recommended_unit,recommended_bed,score,score_aggregate,score_reviews,suburb,title
"131-135 Bourke Street, 3000 Melbourne, Australia",Citadines on Bourke Melbourne,https://cf.bstatic.com/xdata/images/hotel/square600/29196852.webp?k=5a5eaca4a6256fa7451ba101ec54b55c4699ef51ff5cfbd9499f68f1cba726c4&o=,"Offering modern apartments in the heart of Melbourne CBD, this award-winning 4.5-star property is only 200 metres from Chinatown. Guests enjoy free in-room WiFi, an indoor swimming pool, a sauna and a fitness centre.

Citadines On Bourke is a 20-minute walk from the Melbourne Cricket Ground (MCG) and Rod Laver Arena. Flinders Street Station is just 850 metres away.

Each air-conditioned apartment includes an LCD TV. Your open-plan living space features a kitchenette with a dishwasher, a microwave and a refrigerator. Slippers, dental kits and shaving supplies are available upon request.

Reception is open 24 hours, and the staff can arrange tours and other activities. The lobby offers a range of maps and magazines, including some in Chinese.

Private on-site parking is available, subject to availability upon arrival. There is a tram stop within 5 minutes’ walk of Citadines On Bourke Melbourne, with regular free trams around the city centre.

Staff can assist guests in English.",-37.81255862,https://www.booking.com/hotel/au/citadines-melbourne-on-bourke.en-gb.html?label=gen173nr-1BCAEoggI46AdIM1gEaA-IAQGYAQm4AQfIAQzYAQHoAQGIAgGoAgO4Asyg6bgGwAIB0gIkNDUzODliM2ItZThjZS00MDU4LThmOTctMTZhMmVlODlhZjlj2AIF4AIB&sid=3b52787ec2db0a5e6311a947ae7d40c6&aid=304142&ucfs=1&arphpl=1&checkin=2025-01-13&checkout=2025-01-14&dest_id=1593&dest_type=district&group_adults=1&req_adults=1&no_rooms=1&group_children=0&req_children=0&hpos=20&hapos=95&sr_order=class&nflt=ht_id%3D204&srpvid=947b662f65cb0907&srepoch=1729780354&all_sr_blocks=17674401_88833552_2_0_0_269685&highlighted_blocks=17674401_88833552_2_0_0_269685&matching_block_id=17674401_88833552_2_0_0_269685&sr_pri_blocks=17674401_88833552_2_0_0_269685_35700&from_sustainable_property_sr=1&from=searchresults,144.96931686,357,AUD,"1 night, 1 adult",Includes taxes and charges,Deluxe Studio Apartment,Entire studio•1 bathroom•34m²,8.5,Very,7444,"Melbourne CBD, Melbourne",Citadines on Bourke Melbourne
"550 Flinders Street, 3000 Melbourne, Australia",Brady Apartment Hotel Flinders Street,https://cf.bstatic.com/xdata/images/hotel/square600/391557746.webp?k=376c8f7b9c8f2d322c30ad2e58f396eee37d16cc84a8112725bf8d209f5d7ea0&o=,"Located in the heart of Melbourne CBD, Brady Apartment Hotel Flinders Street features leisure facilities which boast panoramic city views, including an indoor heated pool, spa, sauna and expansive fitness centre. Guests receive free unlimited high-speed WiFi.

Brady Apartment Hotel Flinders Street is located a short walk from the Melbourne Aquarium and the Melbourne Convention & Exhibition Centre, while Crown Entertainment Complex and Southbank Promenade are less than 15 minutes’ walk away. Both Flinders Street and Southern Cross Train Stations are within a 10-minute walk from the property.

The rooms all offer individually controlled heating/cooling, a 49-inch Smart TV, modern furnishings and kitchenette or kitchen facilities. The One and Two-Bedroom Apartments feature balconies and full laundry and drying facilities in the room.

The hotel is located close to a range of local restaurants, bars and cafes making it easily accessible for guests to experience the best of Melbourne’s world renowned food culture.",-37.82059471,https://www.booking.com/hotel/au/brandy-hotels-flinders-street.en-gb.html?label=gen173nr-1BCAEoggI46AdIM1gEaA-IAQGYAQm4AQfIAQzYAQHoAQGIAgGoAgO4Asyg6bgGwAIB0gIkNDUzODliM2ItZThjZS00MDU4LThmOTctMTZhMmVlODlhZjlj2AIF4AIB&sid=3b52787ec2db0a5e6311a947ae7d40c6&aid=304142&ucfs=1&arphpl=1&checkin=2025-01-13&checkout=2025-01-14&dest_id=1593&dest_type=district&group_adults=1&req_adults=1&no_rooms=1&group_children=0&req_children=0&hpos=21&hapos=96&sr_order=class&nflt=ht_id%3D204&srpvid=947b662f65cb0907&srepoch=1729780354&all_sr_blocks=3795309_369404516_0_0_0_547855&highlighted_blocks=3795309_369404516_0_0_0_547855&matching_block_id=3795309_369404516_0_0_0_547855&sr_pri_blocks=3795309_369404516_0_0_0_547855_33750&from_sustainable_property_sr=1&from=searchresults,144.95602995,338,AUD,"1 night, 1 adult",Includes taxes and charges,Studio Apartment,Entire apartment•1 bedroom•1 bathroom•32m²,8.4,Very,2902,"Melbourne CBD, Melbourne",Brady Apartment Hotel Flinders Street
"182 Collins Street, 3000 Melbourne, Australia",Hotel Collins,https://cf.bstatic.com/xdata/images/hotel/square600/292951410.webp?k=896fe9a1847d09eac12c74d02c3dd271ff83f0ed2784f34e13d27039e2cfa923&o=,"Located in the ‘Paris end’ of Collins St Melbourne, and nestled between luxury boutiques, institutional restaurants / bars and iconic sites of Melbourne, Hotel Collins is right in the very heart of the city’s thriving business and entertainment district, and will provide you with endless possibilities right on your door-step.

Hotel Collins is located just 275-meters from Federation Square and 366-meters from Bourke Street Mall. It is across the road from the Regent Theatre, and less than 10-minutes' walk from Etihad Stadium and Melbourne Convention Center, and a 24-minute walk to the Melbourne Cricket Ground. Melbourne Airport is a 22-minute drive away.

Decorated with contemporary furnishings, these air-conditioned apartments offer a flat-screen TV, self contained kitchenette, and complimentary high-speed WiFi and guest laundry. There is a separate dining area and dining table. Featuring a shower, the private bathroom also has a hairdryer and free toiletries.

This is our guests' favorite part of Melbourne, according to independent reviews.

Families in particular like the location – they rated it 9.4 for a stay with kids.",-37.81479800,https://www.booking.com/hotel/au/adara-collins.en-gb.html?label=gen173nr-1BCAEoggI46AdIM1gEaA-IAQGYAQm4AQfIAQzYAQHoAQGIAgGoAgO4Asyg6bgGwAIB0gIkNDUzODliM2ItZThjZS00MDU4LThmOTctMTZhMmVlODlhZjlj2AIF4AIB&sid=3b52787ec2db0a5e6311a947ae7d40c6&aid=304142&ucfs=1&arphpl=1&checkin=2025-01-13&checkout=2025-01-14&dest_id=1593&dest_type=district&group_adults=1&req_adults=1&no_rooms=1&group_children=0&req_children=0&hpos=22&hapos=97&sr_order=class&nflt=ht_id%3D204&srpvid=947b662f65cb0907&srepoch=1729780354&all_sr_blocks=102767702_100544408_2_0_0&highlighted_blocks=102767702_100544408_2_0_0&matching_block_id=102767702_100544408_2_0_0&sr_pri_blocks=102767702_100544408_2_0_0__39900&from_sustainable_property_sr=1&from=searchresults,144.96745100,399,AUD,"1 night, 1 adult",Includes taxes and charges,Studio Apartment,Entire apartment•1 bedroom•1 bathroom•1 kitchen•38m²,8.2,Very,3570,"Melbourne CBD, Melbourne",Hotel Collins
"750 Bourke Street Docklands, Docklands, 3008 Melbourne, Australia",Quest Docklands,https://cf.bstatic.com/xdata/images/hotel/square600/95033948.webp?k=ed843f8317b20b62493e93e15b72b65292f40a39aea8abbda0814284c9e55bd1&o=,"Quest Docklands offers stylish serviced apartments in Central Melbourne, just 5 minutes’ walk from the waterfront. You can stay connected in the well-equipped business centre or work up a sweat in the fitness centre.

Quest Docklands is located next door to Etihad Stadium and is 15 minutes’ walk from the vibrant restaurants, bars, and cafes of Southbank Promenade. Melbourne Airport is 20 minutes’ drive away.

These refurbished apartments are air-conditioned and offer an LCD TV with cable channels. Laundry and kitchen facilities are provided for your comfort. You can enjoy views over the city, and some apartments include a balcony.

This aparthotel offers in-room dining options as well as charge-back facilities at 10 local restaurants. On-site parking and WiFi are available for an additional charge.",-37.81836505,https://www.booking.com/hotel/au/quest-docklands-apartment.en-gb.html?label=gen173nr-1BCAEoggI46AdIM1gEaA-IAQGYAQm4AQfIAQzYAQHoAQGIAgGoAgO4Asyg6bgGwAIB0gIkNDUzODliM2ItZThjZS00MDU4LThmOTctMTZhMmVlODlhZjlj2AIF4AIB&sid=3b52787ec2db0a5e6311a947ae7d40c6&aid=304142&ucfs=1&arphpl=1&checkin=2025-01-13&checkout=2025-01-14&dest_id=1593&dest_type=district&group_adults=1&req_adults=1&no_rooms=1&group_children=0&req_children=0&hpos=23&hapos=98&sr_order=class&nflt=ht_id%3D204&srpvid=947b662f65cb0907&srepoch=1729780354&all_sr_blocks=150837901_362381064_0_0_0&highlighted_blocks=150837901_362381064_0_0_0&matching_block_id=150837901_362381064_0_0_0&sr_pri_blocks=150837901_362381064_0_0_0__41670&from_sustainable_property_sr=1&from=searchresults,144.94805920,417,AUD,"1 night, 1 adult",Includes taxes and charges,Studio Apartment,Entire apartment•1 bedroom•1 bathroom•26m²,8.7,Fabulous,2178,"Docklands, Melbourne",Quest Docklands
"133 City Road, Southbank, 3006 Melbourne, Australia",Imagine Southbank,https://cf.bstatic.com/xdata/images/hotel/square600/465168177.webp?k=fc85c61b14034633e5423ef1bc3cb63a14b3b3c40ba8464c042cd8c9d696da60&o=,"Ideally located in the centre of Melbourne, Imagine Southbank is within 300 metres of Eureka Tower and 500 metres of Southbank Promenade. Featuring a fitness centre, the 4-star hotel has air-conditioned rooms with free WiFi, each with a private bathroom. Private parking is available on site.

All guest rooms come with a fridge, dishwasher, a kettle, a shower, free toiletries and a wardrobe. Rooms are fitted with a flat-screen TV, and some units at the hotel have a balcony. At Imagine Southbank the rooms are equipped with bed linen and towels.

The accommodation offers an indoor pool.

Popular points of interest near Imagine Southbank include National Gallery of Victoria, Crown Casino Melbourne and Arts Centre Melbourne. Essendon Fields Airport is 12 km from the property.",-37.82327900,https://www.booking.com/hotel/au/imagine-wrap.en-gb.html?label=gen173nr-1BCAEoggI46AdIM1gEaA-IAQGYAQm4AQfIAQzYAQHoAQGIAgGoAgO4Asyg6bgGwAIB0gIkNDUzODliM2ItZThjZS00MDU4LThmOTctMTZhMmVlODlhZjlj2AIF4AIB&sid=3b52787ec2db0a5e6311a947ae7d40c6&aid=304142&ucfs=1&arphpl=1&checkin=2025-01-13&checkout=2025-01-14&dest_id=1593&dest_type=district&group_adults=1&req_adults=1&no_rooms=1&group_children=0&req_children=0&hpos=24&hapos=99&sr_order=class&nflt=ht_id%3D204&srpvid=947b662f65cb0907&srepoch=1729780354&all_sr_blocks=881032301_357316804_0_0_0&highlighted_blocks=881032301_357316804_0_0_0&matching_block_id=881032301_357316804_0_0_0&sr_pri_blocks=881032301_357316804_0_0_0__30305&from_sustainable_property_sr=1&from=searchresults,144.96351900,303,AUD,"1 night, 1 adult",Includes taxes and charges,Studio,Entire studio•1 bathroom•1 kitchen•40m²,7.6,Good,1108,"Southbank, Melbourne",Imagine Southbank
"221 Rosslyn Street, West Melbourne, 3003 Melbourne, Australia",Melbourne City Apartment Hotel,https://cf.bstatic.com/xdata/images/hotel/square600/369424416.webp?k=6ba7e2d4873e37e448e3e64d28074e7be224b212fb5dce5d06e8c819196c2a80&o=,"Melbourne City Apartment Hotel is ideally situated in the centre of Melbourne, and features an outdoor swimming pool, free WiFi and a garden. This 4-star hotel offers barbecue facilities. Private parking is available on site.

The hotel will provide guests with air-conditioned rooms offering a desk, a coffee machine, a fridge, a microwave, a safety deposit box, a flat-screen TV and a private bathroom with a shower. Every room comes with a kettle, while some rooms are fitted with a kitchen with an oven and a stovetop. At Melbourne City Apartment Hotel the rooms include bed linen and towels.

Popular points of interest near the accommodation include Southern Cross Station, Marvel Stadium and Melbourne City Conference Centre. Essendon Fields Airport is 10 km from the property.",-37.80984,https://www.booking.com/hotel/au/adina-apartment-west-melbourne.en-gb.html?label=gen173nr-1BCAEoggI46AdIM1gEaA-IAQGYAQm4AQfIAQzYAQHoAQGIAgGoAgO4Asyg6bgGwAIB0gIkNDUzODliM2ItZThjZS00MDU4LThmOTctMTZhMmVlODlhZjlj2AIF4AIB&sid=3b52787ec2db0a5e6311a947ae7d40c6&aid=304142&ucfs=1&arphpl=1&checkin=2025-01-13&checkout=2025-01-14&dest_id=1593&dest_type=district&group_adults=1&req_adults=1&no_rooms=1&group_children=0&req_children=0&hpos=25&hapos=100&sr_order=class&nflt=ht_id%3D204&srpvid=947b662f65cb0907&srepoch=1729780354&all_sr_blocks=636320912_249223252_0_0_0&highlighted_blocks=636320912_249223252_0_0_0&matching_block_id=636320912_249223252_0_0_0&sr_pri_blocks=636320912_249223252_0_0_0__36120&from_sustainable_property_sr=1&from=searchresults,144.948945,361,AUD,"1 night, 1 adult",Includes taxes and charges,Queen Studio,Entire studio•1 bathroom•30m²,9.0,Superb,2373,"West Melbourne, Melbourne",Melbourne City Apartment Hotel
"388 Lonsdale Street, 3000 Melbourne, Australia",Brady Apartment Hotel Hardware Lane,https://cf.bstatic.com/xdata/images/hotel/square600/391482944.webp?k=4093735ff11c634085c59fdd7c0d750080c6e79f0bb669fbe7a372f6a325f9a0&o=,"Boasting a fitness centre, Brady Apartment Hotel Hardware Lane is situated in the centre of Melbourne, 500 metres from Melbourne City Conference Centre. This 4-star hotel offers a 24-hour front desk, a concierge service and free WiFi. Some rooms at the property have a terrace with a city view.

The hotel will provide guests with air-conditioned rooms with a desk, a kettle, a fridge, a dishwasher, a safety deposit box, a flat-screen TV and a private bathroom with a shower. At Brady Apartment Hotel Hardware Lane the rooms include bed linen and towels.

Popular points of interest near the accommodation include State Library of Victoria, Block Arcade Melbourne and Melbourne Central Station. The nearest airport is Essendon Fields Airport, 11 km from Brady Apartment Hotel Hardware Lane.",-37.812429,https://www.booking.com/hotel/au/brady-hotels-hardware-lane.en-gb.html?label=gen173nr-1BCAEoggI46AdIM1gEaA-IAQGYAQm4AQfIAQzYAQHoAQGIAgGoAgO4Asyg6bgGwAIB0gIkNDUzODliM2ItZThjZS00MDU4LThmOTctMTZhMmVlODlhZjlj2AIF4AIB&sid=3b52787ec2db0a5e6311a947ae7d40c6&aid=304142&ucfs=1&arphpl=1&checkin=2025-01-13&checkout=2025-01-14&dest_id=1593&dest_type=district&group_adults=1&req_adults=1&no_rooms=1&group_children=0&req_children=0&hpos=1&hapos=101&sr_order=class&nflt=ht_id%3D204&srpvid=947b662f65cb0907&srepoch=1729780363&all_sr_blocks=735488701_369404380_0_0_0_547853&highlighted_blocks=735488701_369404380_0_0_0_547853&matching_block_id=735488701_369404380_0_0_0_547853&sr_pri_blocks=735488701_369404380_0_0_0_547853_44900&from_sustainable_property_sr=1&from=searchresults,144.960831,449,AUD,"1 night, 1 adult",Includes taxes and charges,One Bedroom Apartment,Entire apartment•1 bedroom•1 living room•1 bathroom•1 kitchen•50m²,8.4,Very,2770,"Melbourne CBD, Melbourne",Brady Apartment Hotel Hardware Lane
"8 Franklin St, 3000 Melbourne, Australia",Milano Serviced Apartments,https://cf.bstatic.com/xdata/images/hotel/square600/316022015.webp?k=a79165b0e84bc6534f3d615f745fb8530f7b6c51475423296382fe374cd575ce&o=,"Featuring an indoor swimming pool, fitness centre, private cinema, tennis court and rock climbing wall, Milano offers stylish apartments in the heart of Melbourne CBD, with shopping and restaurants on your doorstep.

Milano Serviced Apartments Melbourne are just 450 metres from the Queen Victoria Market and 20 minutes’ walk from Federation Square.  RMIT University is across the road.

Each apartment has a fully equipped kitchen with oven, microwave, refrigerator and dishwasher. All separate living and dining areas include a flat-screen TV with cable channels and DVD player.

The fully equipped modern fitness centre features a sauna, heated spa pool and views over the city. Guests can relax in the club lounge or enjoy a BBQ on the rooftop terrace.

Secure covered car parking and a guest laundry service are available. There is a tram stop only 150 metres from Milano Serviced Apartments.",-37.8074486897671,https://www.booking.com/hotel/au/milano-serviced-apartments.en-gb.html?label=gen173nr-1BCAEoggI46AdIM1gEaA-IAQGYAQm4AQfIAQzYAQHoAQGIAgGoAgO4Asyg6bgGwAIB0gIkNDUzODliM2ItZThjZS00MDU4LThmOTctMTZhMmVlODlhZjlj2AIF4AIB&sid=3b52787ec2db0a5e6311a947ae7d40c6&aid=304142&ucfs=1&arphpl=1&checkin=2025-01-13&checkout=2025-01-14&dest_id=1593&dest_type=district&group_adults=1&req_adults=1&no_rooms=1&group_children=0&req_children=0&hpos=2&hapos=102&sr_order=class&nflt=ht_id%3D204&srpvid=947b662f65cb0907&srepoch=1729780363&all_sr_blocks=36841004_93617124_4_0_0&highlighted_blocks=36841004_93617124_4_0_0&matching_block_id=36841004_93617124_4_0_0&sr_pri_blocks=36841004_93617124_4_0_0__31800&from_sustainable_property_sr=1&from=searchresults,144.96263086795807,318,AUD,"1 night, 1 adult",Includes taxes and charges,Deluxe Two-Bedroom Apartment,Entire apartment•1 bedroom•1 bathroom•1 kitchen•62m²,7.5,Good,1557,"Melbourne CBD, Melbourne",Milano Serviced Apartments
"19 Little Bourke Street, 3000 Melbourne, Australia",Laneways by Ovolo,https://cf.bstatic.com/xdata/images/hotel/square600/436114343.webp?k=e46c2eedb0e1ec05ad698b3270b98771a226443634e46b999fe42825413cc87b&o=,"Deep within the vibrant heart of Melbourne’s many tangled laneways, lives a little hotel with a big personality. An eclectic inner-city stay infused with rebel spirit that beats to a different drum.

Infused with creative flair, Laneways by Ovolo is a colourful nod (and a cheeky wink) to Melbourne’s paint-splashed streets.

With 43 Memphis-inspired rooms, tailored to the weekend adventurer and the corporate crusader, it’s the perfect spot to kick off your heels, or slip on some sneakers and hit the cobblestones.

Outside, wander art-filled arcades rich with the aroma of roasted coffee. Explore avant-garde galleries and bustling boutiques. Or catch a show in the city’s thriving theatre district.

At Laneways by Ovolo — find yourself centre stage. And lose yourself in a world of culture, cuisine and curiosity. This restaurant/bar is now closed.",-37.810728,https://www.booking.com/hotel/au/ovolo-melbourne.en-gb.html?label=gen173nr-1BCAEoggI46AdIM1gEaA-IAQGYAQm4AQfIAQzYAQHoAQGIAgGoAgO4Asyg6bgGwAIB0gIkNDUzODliM2ItZThjZS00MDU4LThmOTctMTZhMmVlODlhZjlj2AIF4AIB&sid=3b52787ec2db0a5e6311a947ae7d40c6&aid=304142&ucfs=1&arphpl=1&checkin=2025-01-13&checkout=2025-01-14&dest_id=1593&dest_type=district&group_adults=1&req_adults=1&no_rooms=1&group_children=0&req_children=0&hpos=3&hapos=103&sr_order=class&nflt=ht_id%3D204&srpvid=947b662f65cb0907&srepoch=1729780363&all_sr_blocks=42274401_91474587_2_2_0&highlighted_blocks=42274401_91474587_2_2_0&matching_block_id=42274401_91474587_2_2_0&sr_pri_blocks=42274401_91474587_2_2_0__50065&from_sustainable_property_sr=1&from=searchresults,144.97232800000006,501,AUD,"1 night, 1 adult",Includes taxes and charges,Downtown Studio,1 large double bed,8.8,Fabulous,575,"Melbourne CBD, Melbourne",Laneways by Ovolo
"585 La Trobe Street, 3000 Melbourne, Australia",HarbourView Apartment Hotel (now Arrow on Spencer),https://cf.bstatic.com/xdata/images/hotel/square600/83787348.webp?k=2ff5172594c2ac4c66b5b10942282271f9a44e94bd349f2133681e9fd305321c&o=,"HarbourView Apartment Hotel is located in the heart of Melbourne CBD and offers a wide range of room types from budget accommodation to spacious self-contained kitchenette serviced apartments with free WiFi in all rooms.

There are free tram stops right outside your door, allowing guests to have easy access to most of Melbourne's attractions. HarbourView Apartment Hotel is located only 22 km from Melbourne Airport and less than 10 minutes’ walk to the airport shuttle bus service from Southern Cross Station. Etihad Stadium is a 10-minute walk away.

On-site parking is subject to availability and charges apply.",-37.813172284413206,https://www.booking.com/hotel/au/harbourview-apartment.en-gb.html?label=gen173nr-1BCAEoggI46AdIM1gEaA-IAQGYAQm4AQfIAQzYAQHoAQGIAgGoAgO4Asyg6bgGwAIB0gIkNDUzODliM2ItZThjZS00MDU4LThmOTctMTZhMmVlODlhZjlj2AIF4AIB&sid=3b52787ec2db0a5e6311a947ae7d40c6&aid=304142&ucfs=1&arphpl=1&checkin=2025-01-13&checkout=2025-01-14&dest_id=1593&dest_type=district&group_adults=1&req_adults=1&no_rooms=1&group_children=0&req_children=0&hpos=4&hapos=104&sr_order=class&nflt=ht_id%3D204&srpvid=947b662f65cb0907&srepoch=1729780363&all_sr_blocks=26230627_89979814_8_0_0_274791&highlighted_blocks=26230627_89979814_8_0_0_274791&matching_block_id=26230627_89979814_8_0_0_274791&sr_pri_blocks=26230627_89979814_8_0_0_274791_45833&from_sustainable_property_sr=1&from=searchresults,144.95177328586578,458,AUD,"1 night, 1 adult",Includes taxes and charges,Penthouse Four-Bedroom Apartment,Entire apartment•4 bedrooms•1 living room•2 bathrooms•1 kitchen•80m²,7.1,Good,3620,"Melbourne CBD, Melbourne",HarbourView Apartment Hotel (now Arrow on Spencer)
"199 William Street, 3000 Melbourne, Australia",Wyndham Hotel Melbourne,https://cf.bstatic.com/xdata/images/hotel/square600/194654644.webp?k=e28b312182ddd06ca3de3544b56314fff3e0b60aac1d02a81b8c5384510350bb&o=,"Located in the heart of Melbourne, Wyndham on William offers stylish accommodation within 10 minutes' walk of Melbourne's vibrant cafes, restaurants and bars. It features a rooftop heated pool, a fitness centre and a library.

Wyndham on William is 5 minutes' tram ride from Etihad Stadium, Festival Hall and Docklands. It is 10 minutes' walk from Queen Victoria Market. Melbourne Airport is 20 minutes' drive away. Guests can enjoy a show from one of Melbourne's iconic theatres including Princess Theatre, 10 minutes' walk away.

Each spacious apartment is air-conditioned offers modern décor. It features flat-screen TV, a refrigerator and tea and coffee making facilities. The private bathroom includes a shower.

Hotel facilities include a 24-hour front desk, meeting rooms, and a BBQ area.",-37.81449989,https://www.booking.com/hotel/au/wyndham-on-william.en-gb.html?label=gen173nr-1BCAEoggI46AdIM1gEaA-IAQGYAQm4AQfIAQzYAQHoAQGIAgGoAgO4Asyg6bgGwAIB0gIkNDUzODliM2ItZThjZS00MDU4LThmOTctMTZhMmVlODlhZjlj2AIF4AIB&sid=3b52787ec2db0a5e6311a947ae7d40c6&aid=304142&ucfs=1&arphpl=1&checkin=2025-01-13&checkout=2025-01-14&dest_id=1593&dest_type=district&group_adults=1&req_adults=1&no_rooms=1&group_children=0&req_children=0&hpos=5&hapos=105&sr_order=class&nflt=ht_id%3D204&srpvid=947b662f65cb0907&srepoch=1729780363&all_sr_blocks=117134412_117996755_0_0_0_443650&highlighted_blocks=117134412_117996755_0_0_0_443650&matching_block_id=117134412_117996755_0_0_0_443650&sr_pri_blocks=117134412_117996755_0_0_0_443650_53010&from=searchresults,144.95747200,530,AUD,"1 night, 1 adult",Includes taxes and charges,Two Bedroom Apartment,Entire apartment•2 bedrooms•1 living room•1 bathroom•1 kitchen•47m²,8.4,Very,1767,"Melbourne CBD, Melbourne",Wyndham Hotel Melbourne
"111 Little Lonsdale Street, 3000 Melbourne, Australia",Brady Hotels Jones Lane,https://cf.bstatic.com/xdata/images/hotel/square600/512481758.webp?k=81d6bc6083032bbaaa0c23858459898e533047bbbba2ab78ae8ebf237061a041&o=,"Ideally set in Melbourne, Brady Hotels Jones Lane features air-conditioned rooms, a fitness centre, free WiFi and a terrace. This 4-star hotel offers a 24-hour front desk and a concierge service. The property is non-smoking and is situated 500 metres from Princess Theatre.

At the hotel, the rooms are fitted with a wardrobe, a flat-screen TV, a private bathroom, bed linen and towels. Each room is equipped with a safety deposit box, while some rooms also boast a balcony and others also feature city views. All rooms will provide guests with a fridge.

Popular points of interest near Brady Hotels Jones Lane include Melbourne Central Station, State Library of Victoria and Melbourne Museum. Essendon Fields Airport is 11 km from the property.",-37.809426,https://www.booking.com/hotel/au/brady-hotels-jones-lane.en-gb.html?label=gen173nr-1BCAEoggI46AdIM1gEaA-IAQGYAQm4AQfIAQzYAQHoAQGIAgGoAgO4Asyg6bgGwAIB0gIkNDUzODliM2ItZThjZS00MDU4LThmOTctMTZhMmVlODlhZjlj2AIF4AIB&sid=3b52787ec2db0a5e6311a947ae7d40c6&aid=304142&ucfs=1&arphpl=1&checkin=2025-01-13&checkout=2025-01-14&dest_id=1593&dest_type=district&group_adults=1&req_adults=1&no_rooms=1&group_children=0&req_children=0&hpos=6&hapos=106&sr_order=class&nflt=ht_id%3D204&srpvid=947b662f65cb0907&srepoch=1729780363&all_sr_blocks=480583201_369404369_2_0_0_547852&highlighted_blocks=480583201_369404369_2_0_0_547852&matching_block_id=480583201_369404369_2_0_0_547852&sr_pri_blocks=480583201_369404369_2_0_0_547852_49400&from_sustainable_property_sr=1&from=searchresults,144.968631,494,AUD,"1 night, 1 adult",Includes taxes and charges,King Room,1 extra-large double bed,8.6,Fabulous,3340,"Melbourne CBD, Melbourne",Brady Hotels Jones Lane
